Title,Original title,ID,Language,Details,Genre IDs,Popularity,Release date,Review score,Number of reviews
Divertimento,Divertimento,958179,fr,"’95–’96, year of high school. Only 17 years old, Zahia Ziouni becomes aware that her dream of becoming a conductor and her ambition to make symphonic music accessible to all and in all territories, will go through the creation of an orchestra unique in its diversity and composition. Helped by her twin sister Fettouma, a cellist, and while she was about to conduct her very first concert, she created the Divertimento orchestra. The latter still exists and, at 44 years old, Zahia is now a conductor recognized worldwide.","[18, 36]",3.362,2023-01-25,7.5,46
A Merry Scottish Christmas,A Merry Scottish Christmas,1145635,en,"When estranged siblings Lindsay and Brad travel to Scotland at Christmas to reunite with their mother Jo, a big family secret is revealed.","[10770, 35, 10749]",6.44,2023-11-18,7.5,15
For Better And For Worse,Un homme heureux,875818,fr,"Jean has been the conservative mayor of a small town for several years. He intends to run for another term. Edith, his wife, is the paragon of the traditional devoted housewife and mother. So it comes as quite a shock when she tells her husband of forty years that deep down, she has always been... A MAN! Totally blindsided, Jean didn't see this coming. For a politician campaigning on family values, this is too much! But Edith, still the loving wife, make a deal with him: she will postpone her transition and stay a woman until after the elections. But as we know, campaigns are all about digging up dirt to keep the rumor mill turning",[35],6.278,2023-02-15,5.4,71
Green Border,Zielona granica,1121956,pl,"In the treacherous and swampy forests that make up the so called “green border” between Belarus and Poland, refugees from the Middle East and Africa trying to reach the European Union are trapped in a geopolitical crisis cynically engineered by Belarusian dictator Alexander Lukashenko. In an attempt to provoke Europe, refugees are lured to the border by propaganda promising easy passage to the EU. Pawns in this hidden war, the lives of Julia, a newly minted activist who has given up her comfortable life, Jan, a young border guard, and a Syrian family intertwine.",[18],7.822,2023-09-22,7.4,18
Of an Age,Of an Age,958340,en,A Serbian ballroom dancer experiences an unexpected and intense 24-hour romance with a friend's older brother.,"[10749, 18]",6.104,2023-02-10,7.1,32
Snow Falls,Snow Falls,737853,en,"After a winter storm strands five friends in a remote cabin with no power and little food, disorientation slowly claims their sanity as each of them succumbs to a fear that the snow itself may be contaminated or somehow evil.",[27],4.815,2023-01-17,4.6,31
Het Geheugenspel,Het Geheugenspel,1110820,nl,"The body of Nathalie, who disappeared 25 years ago, is found on the Deridder family estate. The event reveals a long-hidden crime, and when secrets are brought forth, the present is overshadowed by the past.",[53],3.772,2023-05-18,6.0,12
Imagine Dragons: Live in Vegas,Imagine Dragons: Live in Vegas,1128979,en,"Far from the days of playing in dive bars and casinos across the Strip, Imagine Dragons return home to perform at Las Vegas’ largest stage, Allegiant Stadium, in a triumphant concert film that showcases the band’s rise to fame and the city that helped shape their sound.","[99, 10402]",3.408,2023-07-14,8.3,24
Captain Volkonogov Escaped,Капитан Волконогов бежал,818621,ru,"Captain Fedor Volkonogov works in law enforcement. He is on the good books of the management, and his colleagues respect him. But one day, his life abruptly changes: he is declared a criminal. The Captain manages to run away before he is arrested. Suddenly he turns into an outcast, whom his former colleagues search across the whole city. At night Volkonogov is visited by a messenger from the other world, who warns him that after death he will go hell and be tormented forever. But he has an opportunity to change his fate and get to paradise if he repents, and at least one person forgives him. The Captain embarks on his way to find forgiveness. But he cannot even fathom what tests are awaiting him on this way.","[53, 18]",5.406,2023-01-05,7.2,36
WWE WrestleMania 39 Saturday,WWE WrestleMania 39 Saturday,1005575,en,WrestleMania goes Hollywood as WWE Superstars compete on The Grandest Stage of Them All in Los Angeles. John Cena challenges Austin Theory for the United State Championship. Charlotte Flair defends the SmackDown Women’s Title against Rhea Ripley.,"[28, 10751]",5.831,2023-04-01,7.7,23
What Comes Around,What Comes Around,1005731,en,A young love affair becomes a menacing game of cat and mouse where nothing is what it seems in this immersive thriller.,"[18, 53]",6.018,2023-08-04,5.7,19
Missed Connections,Missed Connections,1123342,tl,"After an unforgettable encounter, a hopeless romantic turns to an app to seek out a man she just met — but is he really what she's looking for?","[10749, 35, 18]",5.269,2023-06-02,6.0,12
Spirit of Ecstasy,La Vénus d'argent,1001245,fr,"Jeanne lives on a military base with an abrasive father, forced to care for their younger siblings while dreaming of breaking out of the family’s milieu by becoming a high-powered financial analyst.",[18],3.596,2023-11-22,5.8,13
¿Cómo matar a mamá?,¿Cómo matar a mamá?,1096905,es,"After learning an irreversible truth, Camila, Teté and Margo must abandon their busy lives to come up with a plan to end their mother Rosalinda's life.","[18, 35]",7.644,2023-05-10,6.8,12
Holiday Hotline,Holiday Hotline,1180811,en,"Upon leaving London and working at a cooking hotline, Abby connects with an anonymous caller — a single dad who Abby unknowingly is also smitten with in real life.","[10770, 35, 18, 10749]",3.265,2023-11-19,7.2,11
Strangers by Night,Une nuit,1000409,fr,"In a crowded subway train, a woman pushes a man. They argue. Their little joust ""barks loudly"", but does not lack charm... Later, in the corridors of the station, the two strangers make love awkwardly in the booth of a photo booth. At last, on the surface, they will say goodbye...","[10749, 18]",4.541,2023-07-05,6.6,29
Pictures of Ghosts,Retratos Fantasmas,1112548,pt,Downtown Recife’s classic movie palaces from the 20th century are mostly gone. That city area is now an archaeological site of sorts that reveals aspects of life in society which have been lost. And that’s just part of the story.,[99],4.298,2023-08-24,8.1,28
Door Mouse,Door Mouse,807023,en,A burlesque dancer with dreams of becoming a comic book artist investigates the disappearance of a close friend.,"[53, 9648, 18]",3.507,2023-01-13,5.7,13
I peggiori giorni,I peggiori giorni,1054698,it,"Four episodes – Christmas, May 1st (Labour Day), August 15th (Ferragosto), Halloween – to tell four stories that delve into the human soul.",[35],4.598,2023-08-14,6.0,65
BS High,BS High,1070807,en,"After a nationally televised high school football game between top-ranked IMG Academy and unknown Bishop Sycamore ended with an IMG blowout win, it's discovered that Bishop Sycamore isn't at all what it seems.",[99],4.205,2023-06-14,7.0,10
Nosso Sonho,Nosso Sonho,947457,pt,"The life story of Claudinho e Buchecha, greatest icons and most successful duo of the Brazilian funk melody in all time, showing how the rhythm and poetry of the periphery conquered Brazil.","[18, 35, 10402]",6.553,2023-09-21,7.7,22
Dasara,దసరా,885184,te,"In 1990s, Set in small village Veerlapally, Dharani, Vennela, and Suri are childhood friends. Dharani loves Vennela, but she has Suri in her mind. Knowing Suri’s interest in Vennela, Dharani sacrifices his love and helps get them married. But Local politics between Rajanna, Shivanna and the latter's son Chinna Nambi threaten to disrupt their lives.","[28, 53]",3.828,2023-03-30,6.5,15
Àma Gloria,Àma Gloria,803688,fr,"Cleo is six years old, has a myopic look and has been madly in love with Gloria, her nanny, since she was born. When Gloria receives a call and must urgently return to her home in Cape Verde to care for her two children, whom she has not raised, Cleo makes her promise to meet one last time. Gloria accepts and invites Cleo to spend the summer vacations on her island. A last summer that they will spend together, in Gloria’s family, before inevitably saying goodbye.","[18, 35]",3.691,2023-08-30,7.2,16
Buddy Games: Spring Awakening,Buddy Games: Spring Awakening,1017507,en,"Faced with their biggest challenge yet, the gang sets out to honor a lost friend only to find themselves in the middle of where it all began – Spring Break – where they learn their old school ways of partying hardly compete with today's generation.",[35],7.532,2023-05-19,6.4,16
Monica,Monica,540549,en,"After years of estrangement, a trans woman returns home to help care for her dying mother.",[18],3.228,2023-05-12,5.9,12
2018,2018,866440,ml,A disaster film set during the 2018 Kerala Floods where people from all walks of life faced catastrophic consequences and put in collective efforts to survive the calamity.,"[53, 28, 12]",6.915,2023-05-05,7.5,26
Untold: Jake Paul the Problem Child,Untold: Jake Paul the Problem Child,1141228,en,Pro boxing sensation — and perennial troublemaker — Jake Paul shares his unlikely journey from online prankster to power puncher in this documentary.,[99],4.367,2023-08-01,5.9,23
Marui Video,마루이 비디오,977155,ko,"The video evidence of the murder, which is especially brutal and graphic, that shouldn't be released to the public; a reporter who has access to the prosecutor's office hears about a cursed tape in the video archive and begins reporting on it.","[9648, 27, 53]",3.75,2023-02-01,5.1,13
Wait with Me,Wait with Me,1046043,en,"When romance novelist Kate Smith suddenly gets writer's block as she's beginning the final installment of her international bestselling steamy Bed 'n Breakfast series, she'll do pretty much anything to get her groove back. Like sneak into a Tire Depot waiting room because her words flow there just like complimentary coffee-smooth, sweet, and scorchingly hot. She manages to fly under the radar until the rugged and charming mechanic, Miles Hudson, notices the quirky redhead slinking in and out of the employees only entrance. But she's way too intriguing to blow the whistle on. Doing a test-drive of her new book idea sounds like a much better option.",[10749],6.253,2023-03-30,6.2,13
Girl Unknown,La desconocida,886544,es,"Carolina and Leo, who have met through a chat room, agree to meet in person in a secluded city park.","[18, 53]",3.178,2023-06-09,5.0,11
Bheed,भीड़,1081726,hi,"8 hours, complete lockdown in the whole of India, movement shut and state borders sealed. Thousands of migrants without food, water and mode of transport were forced to return to their homes. A crisis that shook the whole nation, a time when borders of disparity divided the people and one man stood for humanity.",[18],3.969,2023-03-24,6.0,12
Soy inocente,Soy inocente,1073736,es,"Sofia leads an austere life as a housekeeper, wanting to save every penny to support her grandmother and siblings. A day like any other, she finds herself involved in a crime scene in a hotel room. She's innocent, but her prints are everywhere.",[35],3.296,2023-01-15,7.3,15
The Deep Dark,Gueules noires,976830,fr,"1956, in the north of France. A group of underground miners is forced to take a professor to take samples a thousand meters underground. After a landslide that prevents them from going back up, they discover a crypt from another time, and unknowingly awaken a legendary bloodthirsty creature.","[18, 12, 27]",3.166,2023-11-15,4.8,11
Gaslight,गैसलाइट,1092654,hi,"Meesha, a young paraplegic woman confined to a wheelchair, returns to her family’s royal estate after 15 years at the behest of her estranged father, only to learn that he’s mysteriously missing and probably dead.","[27, 53]",3.152,2023-03-31,5.5,13
"Luxembourg, Luxembourg","Люксембург, Люксембург",1005141,uk,"Kolya and Vasylii learn that their father, who left them when they were children, is dying in Luxembourg, far away from them. One of them wants to go and find his father, while the other one does everything he can to prevent the first from leaving the country. As a result, they both go to Luxembourg in search of their dad: Kolya considers him a hero, while Vasylii thinks he is a scoundrel.","[18, 35]",3.151,2023-04-13,8.1,31
Mrs. Chatterjee Vs Norway,मिसिज़ चैटर्जी वर्सेज़ नॉर्वे,986594,hi,An immigrant Indian mother fights the Norwegian foster care system and legal machinery to win back custody of her children.,"[18, 53]",7.321,2023-03-16,5.2,50
Princes of the Desert,"Zodi et Téhu, frères du désert",1000521,fr,"Zodi, a 12 years old nomad, find an orphan baby dromedary in the desert. He takes in the animal, feeds it, calls it Téhu and becomes its best friend.","[12, 10751, 35]",6.226,2023-02-08,6.6,13
Royal Rendezvous,Royal Rendezvous,1081920,en,A Chef from East L.A. received an invitation to a manor in Ireland to cook for a royal banquet that was planned by a Lord to convince his grandmother to sell their home.,"[10749, 10770]",3.112,2023-02-26,6.9,11
Le Principal,Le Principal,958865,fr,"Sabri Lahlali, the assistant principal of a local high school, is ready to do anything to ensure that his son, who is about to take his high school diploma, has the ideal academic record. But he doesn't know how far his enterprise will take him.","[18, 35]",3.094,2023-05-10,4.8,37
Tom Hanks: The Nomad,Tom Hanks: The Nomad,1128918,en,"From humble beginnings to an aspiring thespian to acting as some of the world's most iconic and notable characters. He has picked up a reputation as 'America's Nice Guy', 'The Everyman' and a nomad of the arts. But we all know him... as Tom Hanks.",[99],3.151,2023-05-20,5.1,10
A Thousand Days,Sewu Dino,1052865,id,"Sri accepts a generous job offer and tasked to perform a cleansing ritual for Dela Atmojo, an unconscious girl who is suffering from the hex of 1000-days. The terror begins when her coworker neglects to finish the ritual. Failing to perform until the 1000th day will result in their demise.","[27, 9648]",5.92,2023-04-19,6.8,11
The Subtle Art of Not Giving a #@%!,The Subtle Art of Not Giving a #@%!,1032696,en,"Mark Manson cuts through the crap to offer his not-giving-a-f*ck philosophy: a dose of raw, refreshing, honesty that shows us how to live more contented, grounded lives.",[99],4.818,2023-01-04,5.8,25
La quattordicesima domenica del tempo ordinario,La quattordicesima domenica del tempo ordinario,1109148,it,"Samuele and Marzio, as teenagers, make a promise to be friends forever, but adulthood, women and everyday problems sneak into their lives.",[18],3.04,2023-05-04,5.6,39
Righteous Thieves,Righteous Thieves,845890,en,"Annabel, the leader of a secret organization engaged in the recovery of priceless artwork, assembles a ragtag crew of art thieves to recover a Monet, Picasso, Degas, and Van Gogh stolen by Nazis during WWII and now in the possession of neo-Nazi billionaire oligarch Otto Huizen. As the planned heist approaches, loyalties are tested when the crew learns the real reason behind Annabel’s search for the long-lost paintings.","[53, 28, 80]",4.114,2023-03-10,5.7,18
The Saint of Second Chances,The Saint of Second Chances,1115128,en,A baseball dynasty built on fun — and a disco disaster that nearly undid it all. Explore the comeback of a lifetime in this documentary about Mike Veeck.,[99],3.035,2023-06-11,6.9,14
Superpower,Superpower,943330,en,"Sean Penn and Aaron Kaufman’s documentary, shot just before and after Russian invasion of Ukraine on 24th February 2022, and featuring several interviews with Ukraine President Volodymyr Zelensky.",[99],3.02,2023-02-17,5.6,11
Little Richard: I Am Everything,Little Richard: I Am Everything,1053718,en,"The story of the Black queer origins of rock n' roll. It explodes the whitewashed canon of American pop music to reveal the innovator – the originator – Richard Penniman. Through a wealth of archive and performance that brings us into Richard's complicated inner world, the film unspools the icon's life story with all its switchbacks and contradictions.","[99, 10402]",3.017,2023-04-11,7.4,10
All to Play For,Rien à perdre,966488,fr,"Sylvie lives with her two children whom she’s raising on her own. One evening, there’s an accident, and her youngest son is removed from her care. Sylvie must subsequently fight to get her son back and to keep herself afloat.",[18],3.09,2023-11-21,7.0,22
Waltair Veerayya,వాల్తేరు వీరయ్య,989017,te,"A notorious smuggler Waltair Veerayya is hired by a CI Seethapathi, reaches Malaysia with the ostensible mission of kidnapping a drug mafia leader named Solomon, who escaped India after wreaking havoc on the RAW agents and local policemen. Veerayya manages to pummel Solomon, who is fiercely protected by his ruthless gang-lord brother Kaala. Tables are turned, when Veerayya reveals that he shares a turbulent past with Kaala & an ACP Vikram Sagar who is hell-bent on ending his smuggling activities.","[28, 18]",6.127,2023-01-13,5.7,19
Mr. Blake At Your Service!,Complètement cramé!,792614,fr,"Since his wife's death, Andrew Blake is depressed. In an ultimate impetus, he leaves London to go back to France, in the house he met her. This journey through happy days memories won't go as planned.","[18, 35, 10749]",3.217,2023-11-01,7.0,14
Sun and Concrete,Sonne und Beton,915980,de,"The four friends Lukas, Julius, Gino and Sanchez are trying to survive the everyday life in Neukölln, Berlin between drugs, gangs, rap, violence and boredom. Until they are one day making a serious decision with serious consequences because of a dead certain plan.","[80, 18, 12]",5.839,2023-03-02,7.7,51
Sage homme,Sage homme,957770,fr,"After failing the medical entrance exam, Léopold enters midwifery school by default, hiding the truth from those around him. While he is unconvinced of his commitment to this exclusively female environment, his meeting with Nathalie, an experienced midwife with a passionate character, will change his view of this fascinating world and upset his certainties.","[35, 18]",5.31,2023-03-15,7.1,131
Curious Caterer: Grilling Season,Curious Caterer: Grilling Season,1068830,en,"Caterer Goldy Berry reunites with detective Tom Schultz when a realtor is murdered. As they uncover personal and professional rivalries, they realize the culprit is closer than expected.","[10770, 9648]",2.952,2023-02-05,6.9,13
Sapta Sagaradaache Ello – Side A,ಸಪ್ತ ಸಾಗರದಾಚೆ ಎಲ್ಲೊ - ಸೈಡ್ ಎ,1168104,kn,"In the heart of 'Sapta Sagaradaache Ello’ (Somewhere Beyond the Seven Seas), resides an ardent love story between Manu and Priya. Set in 2010, the couple hails from a middle-class background. Circumstances land Manu in jail, putting his relationship with Priya in jeopardy.","[18, 10749]",2.95,2023-09-01,8.1,14
Casanova's Return,Il ritorno di Casanova,802124,it,"Leo Bernardi is a successful and acclaimed Italian director. He’s approaching the end of his career but he cannot accept his slow decline. He has just finished shooting his last movie and he’s deeply sad. The movie is inspired by the novel about Casanova written by Arthur Schnitzler, a character so similar to the director, even more than he could imagine. Schnitzler’s Casanova is aged, glory days are over: he lost his charm and his attraction to women, he’s broke and no more eager to travel through Europe. After a long exile, he just wants to go back to Venice, his homeland. While traveling home Casanova meets a girl, Marcolina. She reawakens his desire, lost for years. So, he tries to seduce her but that leads him to a tragic understanding: he’s an old man now. It’s not by chance that Leo Bernardi decided to tell this story right now, in a pivotal moment of his life and career. The destiny of both Casanova and his director leads them to a final confrontation.","[35, 18]",3.503,2023-03-30,6.1,65
The Hammer,The Hammer,1011869,en,"After a judge passes away under suspicious circumstances, Kim Wheeler finds herself covering a circuit that stretches between Las Vegas and Reno — a rugged, often desolate area where anything and everything can happen.  Kim Wheeler, an attorney who is appointed as a judge for Nevada's 5th district after the former judge's death. As the investigation into the death intensifies, Kim's sister, who runs the local brothel, becomes the prime suspect.","[80, 18]",2.936,2023-01-07,6.7,16
THE LEGEND & BUTTERFLY,THE LEGEND & BUTTERFLY,990365,ja,"Oda Nobunaga and Nōhime were originally married to mend a hostile relationship between neighbouring regions. Unfortunately, they were like oil and water, making for a somewhat unhappy marriage. When Oda's enemy, Imagawa Yoshimoto, attacks Owari with his vast army, Oda is devastated by the overwhelming gap in military strength. However, Nohime encourages him not to despair, and the pair draw up a tactical plan that will allow them to overcome the odds.","[36, 18, 10749]",4.71,2023-01-27,6.6,14
Second Tour,Second Tour,962309,fr,"A disgraced political journalist placed in the soccer section, Miss Pove is asked to follow the presidential campaign in progress. The front-runner is a fifty-year-old heir to a powerful French family and a political novice. Troubled by this candidate, whom she has known to be less smooth in the past, Miss Pove embarks on an investigation that is as surprising as it is jubilant.","[35, 18]",4.421,2023-10-25,6.7,89
Kelce,Kelce,1169207,en,"An intimate and emotional documentary that chronicles Philadelphia Eagles team captain and All-Pro center Jason Kelce’s 2022 season, which began with him confronting one of the most challenging decisions any professional athlete will ever face—is now the time to hang it up?",[99],3.939,2023-09-11,7.4,18
Matt Rife: Natural Selection,Matt Rife: Natural Selection,1195988,en,"From his problem with protection crystals to his beef with social media trolls, comedian Matt Rife holds nothing back in this rollicking stand-up special.",[35],5.119,2023-11-15,6.4,17
The Good Mother,The Good Mother,996347,en,"A journalist and his pregnant girlfriend attempt to track down those responsible for the murder of his estranged son. Together, they confront a world of drugs and corruption in the underbelly of their small city in upstate New York, where they uncover an even darker secret.","[9648, 53, 80, 18]",4.854,2023-08-31,4.6,24
Ma langue au chat,Ma langue au chat,964883,fr,"Fourty-something years old Laure can't bother anything : her job, her husband Daniel... neither her life. Her only ally is her cat named Max. When her friends show up for Daniel's birthday and Max disappear, she cracks up... and starts an investigation. Who made Max disappear ? Who is guilty ? There are more surprises to come...",[35],2.917,2023-04-26,6.1,17
King of Clones,King of Clones,1127211,en,"From groundbreaking human cloning research to a scandalous downfall, this documentary tells the captivating story of Korea's most notorious scientist.",[99],5.294,2023-06-23,7.3,24
Kepler Sexto B,Kepler Sexto B,1096316,es,,"[18, 878]",3.867,2023-06-16,6.9,10
A Heidelberg Holiday,A Heidelberg Holiday,1074788,en,"Heidi heads to the Heidelberg Christmas market to sell her hand-painted ornaments. While there, she falls for a local artisan who helps her reconnect with her lost heritage.","[10770, 10749, 10751, 18]",2.878,2023-11-12,6.8,11
The Stroll,The Stroll,1058623,en,"The history of New York’s Meatpacking District, told from the perspective of transgender sex workers who lived and worked there. Filmmaker Kristen Lovell, who walked “The Stroll” for a decade, reunites her community to recount the violence, policing, homelessness, and gentrification they overcame to build a movement for transgender rights.",[99],3.473,2023-01-23,6.9,15
Jethica,Jethica,934601,en,"While hiding out in New Mexico after a freak accident, Elena runs into Jessica, an old friend from high school. When Jessica's stalker suddenly shows up at their door, they must seek help from beyond the grave to get rid of him, for good.","[35, 14, 18]",3.47,2023-01-13,5.2,15
Nandor Fodor and the Talking Mongoose,Nandor Fodor and the Talking Mongoose,979287,en,"In 1935, Hungarian-American para-psychologist Nandor Fodor began his investigation of a strange occurrence on the Isle of Man. An average British family, the Irvings, claimed to have been contacted by a mysterious entity at their farm. A talking mongoose. Named Gef (Pronounced ""Jeff"".)","[9648, 35]",4.75,2023-09-01,6.0,21
The Pigeon Tunnel,The Pigeon Tunnel,1155770,en,"Academy Award winner Errol Morris pulls back the curtain on the storied life and career of David Cornwell, the former spy known to the literary world as John le Carré.",[99],5.696,2023-10-20,6.9,16
Unexpected Grace,Unexpected Grace,1081445,en,"Grace finds a note from a schoolgirl looking for a friend. Since Grace is still trying to find her place in her new hometown, she excitedly writes back and sets off a chain of events that ultimately changes the lives of three people.","[10770, 18, 10749]",2.857,2023-03-12,8.1,11
Maaveeran,மாவீரன்,987895,ta,"After a head injury, cowardly newspaper cartoonist Sathya hears a voice in his mind, foretells events and puts him in precarious situations and forces him to take on a corrupt politician.","[18, 28]",2.845,2023-07-14,6.9,17
