Title,Original title,ID,Language,Details,Genre IDs,Popularity,Release date,Review score,Number of reviews
The Family Plan,The Family Plan,1029575,en,"Dan Morgan is many things: a devoted husband, a loving father, a celebrated car salesman. He's also a former assassin. And when his past catches up to his present, he's forced to take his unsuspecting family on a road trip unlike any other.","[28, 35]",3443.376,2023-12-14,7.4,577
Rebel Moon - Part One: A Child of Fire,Rebel Moon - Part One: A Child of Fire,848326,en,"When a peaceful colony on the edge of the galaxy finds itself threatened by the armies of the tyrannical Regent Balisarius, they dispatch Kora, a young woman with a mysterious past, to seek out warriors from neighboring planets to help them take a stand.",[878],2288.636,2023-12-15,6.5,1026
The Hunger Games: The Ballad of Songbirds & Snakes,The Hunger Games: The Ballad of Songbirds & Snakes,695721,en,"64 years before he becomes the tyrannical president of Panem, Coriolanus Snow sees a chance for a change in fortunes when he mentors Lucy Gray Baird, the female tribute from District 12.","[18, 878, 28]",2182.886,2023-11-15,7.2,1323
Silent Night,Silent Night,891699,en,"A tormented father witnesses his young son die when caught in a gang's crossfire on Christmas Eve. While recovering from a wound that costs him his voice, he makes vengeance his life's mission and embarks on a punishing training regimen in order to avenge his son's death.","[28, 80]",1441.196,2023-11-30,5.9,234
Aquaman and the Lost Kingdom,Aquaman and the Lost Kingdom,572802,en,"Black Manta, still driven by the need to avenge his father's death and wielding the power of the mythic Black Trident, will stop at nothing to take Aquaman down once and for all. To defeat him, Aquaman must turn to his imprisoned brother Orm, the former King of Atlantis, to forge an unlikely alliance in order to save the world from irreversible destruction.","[28, 12, 14]",1283.474,2023-12-20,6.5,379
Thanksgiving,Thanksgiving,1071215,en,"After a Black Friday riot ends in tragedy, a mysterious Thanksgiving-inspired killer terrorizes Plymouth, Massachusetts - the birthplace of the holiday. Picking off residents one by one, what begins as random revenge killings are soon revealed to be part of a larger, sinister holiday plan.","[27, 9648, 53]",1209.49,2023-11-16,6.7,433
Five Nights at Freddy's,Five Nights at Freddy's,507089,en,"Recently fired and desperate for work, a troubled young man named Mike agrees to take a position as a night security guard at an abandoned theme restaurant: Freddy Fazbear's Pizzeria. But he soon discovers that nothing at Freddy's is what it seems.","[27, 9648]",1063.343,2023-10-25,7.8,3072
Freelance,Freelance,897087,en,"An ex-special forces operative takes a job to provide security for a journalist as she interviews a dictator, but a military coup breaks out in the middle of the interview, they are forced to escape into the jungle where they must survive.","[28, 35]",861.808,2023-10-05,6.5,431
Expend4bles,Expend4bles,299054,en,"Armed with every weapon they can get their hands on and the skills to use them, The Expendables are the world’s last line of defense and the team that gets called when all other options are off the table. But new team members with new styles and tactics are going to give “new blood” a whole new meaning.","[28, 12, 53]",859.833,2023-09-15,6.4,975
The Creator,The Creator,670292,en,"Amid a future war between the human race and the forces of artificial intelligence, a hardened ex-special forces agent grieving the disappearance of his wife, is recruited to hunt down and kill the Creator, the elusive architect of advanced AI who has developed a mysterious weapon with the power to end the war—and mankind itself.","[28, 12, 878]",815.56,2023-09-27,7.2,1736
Wonka,Wonka,787699,en,"Willy Wonka – chock-full of ideas and determined to change the world one delectable bite at a time – is proof that the best things in life begin with a dream, and if you’re lucky enough to meet Willy Wonka, anything is possible.","[35, 10751, 14]",757.327,2023-12-06,7.1,841
Oppenheimer,Oppenheimer,872585,en,The story of J. Robert Oppenheimer's role in the development of the atomic bomb during World War II.,"[18, 36]",731.408,2023-07-19,8.1,5889
A Creature Was Stirring,A Creature Was Stirring,1131755,en,A nurse taking care of her daughter's mysterious affliction struggles to hide her secrets when uninvited strangers take shelter in her house during a lethal blizzard.,[27],1069.666,2023-12-08,5.4,11
Leo,Leo,1075794,en,"Jaded 74-year-old lizard Leo has been stuck in the same Florida classroom for decades with his terrarium-mate turtle. When he learns he only has one year left to live, he plans to escape to experience life on the outside but instead gets caught up in the problems of his anxious students — including an impossibly mean substitute teacher.","[16, 35, 10751]",661.055,2023-11-17,7.5,758
The Exorcist: Believer,The Exorcist: Believer,807172,en,"When two girls disappear into the woods and return three days later with no memory of what happened to them, the father of one girl seeks out Chris MacNeil, who's been forever altered by what happened to her daughter fifty years ago.",[27],633.909,2023-10-04,6.2,717
Trolls Band Together,Trolls Band Together,901362,en,"When Branch's brother, Floyd, is kidnapped for his musical talents by a pair of nefarious pop-star villains, Branch and Poppy embark on a harrowing and emotional journey to reunite the other brothers and rescue Floyd from a fate even worse than pop-culture obscurity.","[16, 10751, 10402, 14, 35]",713.498,2023-10-12,7.1,473
Rumble Through the Dark,Rumble Through the Dark,844416,en,"Set in the dark landscape of the Mississippi Delta, where a former bare-knuckle fighter must win one last fight to pay off his debts to the local mob boss and save his childhood home—the stakes nothing less than life or death.","[53, 28]",881.583,2023-11-03,6.5,30
Chicken Run: Dawn of the Nugget,Chicken Run: Dawn of the Nugget,520758,en,A band of fearless chickens flock together to save poultry-kind from an unsettling new threat: a nearby farm that's cooking up something suspicious.,"[16, 12, 35, 10751]",504.998,2023-12-08,7.2,388
Nowhere,Nowhere,1151534,es,"A young pregnant woman named Mia escapes from a country at war by hiding in a maritime container aboard a cargo ship. After a violent storm, Mia gives birth to the child while lost at sea, where she must fight to survive.","[53, 18]",565.022,2023-09-29,7.5,1017
Muzzle,Muzzle,939335,en,"LAPD K-9 officer Jake Rosser has just witnessed the shocking murder of his dedicated partner by a mysterious assailant. As he investigates the shooter’s identity, he uncovers a vast conspiracy that has a chokehold on the city in this thrilling journey through the tangled streets of Los Angeles and the corrupt bureaucracy of the LAPD.","[28, 80, 18, 53]",544.879,2023-09-29,6.5,138
The Super Mario Bros. Movie,The Super Mario Bros. Movie,502356,en,"While working underground to fix a water main, Brooklyn plumbers—and brothers—Mario and Luigi are transported down a mysterious pipe and wander into a magical new world. But when the brothers are separated, Mario embarks on an epic quest to find Luigi.","[16, 10751, 12, 14, 35]",513.396,2023-04-05,7.7,7672
Talk to Me,Talk to Me,1008042,en,"When a group of friends discover how to conjure spirits using an embalmed hand, they become hooked on the new thrill, until one of them goes too far and unleashes terrifying supernatural forces.","[27, 53]",439.862,2023-07-26,7.2,2015
The Equalizer 3,The Equalizer 3,926393,en,"Robert McCall finds himself at home in Southern Italy but he discovers his friends are under the control of local crime bosses. As events turn deadly, McCall knows what he has to do: become his friends' protector by taking on the mafia.","[28, 53, 80]",456.098,2023-08-30,7.4,2036
Saltburn,Saltburn,930564,en,"Struggling to find his place at Oxford University, student Oliver Quick finds himself drawn into the world of the charming and aristocratic Felix Catton, who invites him to Saltburn, his eccentric family's sprawling estate, for a summer never to be forgotten.","[18, 35, 53]",446.64,2023-11-16,7.2,767
Transformers: Rise of the Beasts,Transformers: Rise of the Beasts,667538,en,"When a new threat capable of destroying the entire planet emerges, Optimus Prime and the Autobots must team up with a powerful faction known as the Maximals. With the fate of humanity hanging in the balance, humans Noah and Elena will do whatever it takes to help the Transformers as they engage in the ultimate battle to save Earth.","[28, 12, 878]",472.405,2023-06-06,7.4,3821
Fast Charlie,Fast Charlie,945937,en,"When his aging mob boss is whacked, Charlie Swift, a loyal friend and hired gun, will stop at nothing to destroy the upcoming crew that took him out.","[28, 80, 18]",465.993,2023-12-08,6.3,52
Fast X,Fast X,385687,en,"Over many missions and against impossible odds, Dom Toretto and his family have outsmarted, out-nerved and outdriven every foe in their path. Now, they confront the most lethal opponent they've ever faced: A terrifying threat emerging from the shadows of the past who's fueled by blood revenge, and who is determined to shatter this family and destroy everything—and everyone—that Dom loves, forever.","[28, 80, 53]",473.253,2023-05-17,7.2,4629
Migration,Migration,940551,en,"After a migrating duck family alights on their pond with thrilling tales of far-flung places, the Mallard family embarks on a family road trip, from New England, to New York City, to tropical Jamaica.","[16, 28, 12, 35, 10751]",425.238,2023-12-06,7.2,80
Godzilla Minus One,ゴジラ-1.0,940721,ja,"In postwar Japan, a new terror rises. Will the devastated people be able to survive... let alone fight back?","[878, 27, 28]",499.386,2023-11-03,8.0,234
Lord of Misrule,Lord of Misrule,853387,en,"When the daughter of the town's new priest goes missing during the harvest festival, a desperate search begins, uncovering the town's dark history and resurfacing tales of a mysterious, malevolent spirit that demands sacrifice.",[27],422.081,2023-10-26,5.8,13
Hell House LLC Origins: The Carmichael Manor,Hell House LLC Origins: The Carmichael Manor,1035982,en,"A group of cold case investigators stay at the Carmichael Manor, site of the grisly and unsolved murders of the Carmichael family back in the eighties. After four nights, the group was never heard from again. What is discovered on their footage is even more disturbing than anything found on the Hell House tapes.","[27, 9648]",643.556,2023-10-24,6.4,49
Retribution,Retribution,762430,en,"When a mysterious caller puts a bomb under his car seat, Matt Turner begins a high-speed chase across the city to complete a specific series of tasks- all with his kids trapped in the back seat.","[28, 53, 80]",383.689,2023-08-23,6.9,796
Meg 2: The Trench,Meg 2: The Trench,615656,en,An exploratory dive into the deepest depths of the ocean of a daring research team spirals into chaos when a malevolent mining operation threatens their mission and forces them into a high-stakes battle for survival.,"[28, 878, 27]",405.209,2023-08-02,6.7,2773
57 Seconds,57 Seconds,937249,en,"When a tech blogger lands an interview with a tech guru and stops an attack on him, he finds a mysterious ring that takes him back 57 seconds into the past.","[53, 878, 28]",464.251,2023-09-29,5.9,248
Barbie,Barbie,346698,en,"Barbie and Ken are having the time of their lives in the colorful and seemingly perfect world of Barbie Land. However, when they get a chance to go to the real world, they soon discover the joys and perils of living among humans.","[35, 12, 14]",394.52,2023-07-19,7.2,6712
All the Names of God,Todos los nombres de Dios,1053592,es,"After being implicated in a terrorist attack, Santi, a taxi driver, is taken hostage by one of the perpetrators.","[18, 28, 53]",430.921,2023-09-15,6.9,28
John Wick: Chapter 4,John Wick: Chapter 4,603692,en,"With the price on his head ever increasing, John Wick uncovers a path to defeating The High Table. But before he can earn his freedom, Wick must face off against a new enemy with powerful alliances across the globe and forces that turn old friends into foes.","[28, 53, 80]",364.655,2023-03-22,7.8,5307
Spider-Man: Across the Spider-Verse,Spider-Man: Across the Spider-Verse,569094,en,"After reuniting with Gwen Stacy, Brooklyn’s full-time, friendly neighborhood Spider-Man is catapulted across the Multiverse, where he encounters the Spider Society, a team of Spider-People charged with protecting the Multiverse’s very existence. But when the heroes clash on how to handle a new threat, Miles finds himself pitted against the other Spiders and must set out on his own to save those he loves most.","[16, 28, 12, 878]",384.574,2023-05-31,8.4,5411
Elemental,Elemental,976573,en,"In a city where fire, water, land and air residents live together, a fiery young woman and a go-with-the-flow guy will discover something elemental: how much they have in common.","[16, 35, 10751, 14, 10749]",397.44,2023-06-14,7.7,3390
Merry Little Batman,Merry Little Batman,870358,en,"This Christmas, Damian Wayne wants to be a superhero like his dad – the one and only Batman. When Damian is left home alone while Batman takes on Gotham’s worst supervillains on Christmas Eve, he stumbles upon a villainous plot to steal Christmas and leaps at the chance to save the day.","[16, 28, 10751, 35]",330.835,2023-12-08,6.6,91
The Flash,The Flash,298618,en,"When his attempt to save his family inadvertently alters the future, Barry Allen becomes trapped in a reality in which General Zod has returned and there are no Super Heroes to turn to. In order to save the world that he is in and return to the future that he knows, Barry's only hope is to race for his life. But will making the ultimate sacrifice be enough to reset the universe?","[28, 12, 878]",339.608,2023-06-13,6.8,3430
Mortal Kombat Legends: Cage Match,Mortal Kombat Legends: Cage Match,1034062,en,"In 1980s Hollywood, action star Johnny Cage is looking to become an A-list actor. But when his costar, Jennifer, goes missing from set, Johnny finds himself thrust into a world filled with shadows, danger, and deceit. As he embarks on a bloody journey, Johnny quickly discovers the City of Angels has more than a few devils in its midst.","[16, 28, 14]",504.382,2023-10-17,7.0,67
My Fault,Culpa mía,1010581,es,"Noah must leave her city, boyfriend, and friends to move into William Leister's mansion, the flashy and wealthy husband of her mother Rafaela. As a proud and independent 17 year old, Noah resists living in a mansion surrounded by luxury. However, it is there where she meets Nick, her new stepbrother, and the clash of their strong personalities becomes evident from the very beginning.","[18, 10749]",345.58,2023-06-08,8.1,2085
Blue Beetle,Blue Beetle,565770,en,"Recent college grad Jaime Reyes returns home full of aspirations for his future, only to find that home is not quite as he left it. As he searches to find his purpose in the world, fate intervenes when Jaime unexpectedly finds himself in possession of an ancient relic of alien biotechnology: the Scarab.","[28, 878, 12]",328.416,2023-08-16,6.9,1988
Wish,Wish,1022796,en,"Asha, a sharp-witted idealist, makes a wish so powerful that it is answered by a cosmic force – a little ball of boundless energy called Star. Together, Asha and Star confront a most formidable foe - the ruler of Rosas, King Magnifico - to save her community and prove that when the will of one courageous human connects with the magic of the stars, wondrous things can happen.","[16, 10751, 14, 12]",328.139,2023-11-13,6.4,240
Leave the World Behind,Leave the World Behind,726209,en,A family's getaway to a luxurious rental home takes an ominous turn when a cyberattack knocks out their devices—and two strangers appear at their door.,"[18, 9648, 53, 878]",316.502,2023-11-22,6.5,1433
PAW Patrol: The Mighty Movie,PAW Patrol: The Mighty Movie,893723,en,"A magical meteor crash lands in Adventure City and gives the PAW Patrol pups superpowers, transforming them into The Mighty Pups.","[16, 10751, 28, 878, 35, 18, 12]",304.427,2023-09-21,7.0,210
Boudica,Boudica,975902,en,"Inspired by events in A.D. 60, Boudica follows the eponymous Celtic warrior who rules the Iceni people alongside her husband Prasutagus. When he dies at the hands of Roman soldiers, Boudica’s kingdom is left without a male heir and the Romans seize her land and property.  Driven to the edge of madness and determined to avenge her husband’s death, Boudica rallies the various tribes from the region and wages an epic war against the mighty Roman empire.","[28, 10752]",474.485,2023-10-26,6.0,95
Saw X,Saw X,951491,en,"Between the events of 'Saw' and 'Saw II', a sick and desperate John Kramer travels to Mexico for a risky and experimental medical procedure in hopes of a miracle cure for his cancer, only to discover the entire operation is a scam to defraud the most vulnerable. Armed with a newfound purpose, the infamous serial killer returns to his work, turning the tables on the con artists in his signature visceral way through devious, deranged, and ingenious traps.","[27, 53, 9648]",336.394,2023-09-26,7.4,1365
Gran Turismo,Gran Turismo,980489,en,The ultimate wish-fulfillment tale of a teenage Gran Turismo player whose gaming skills won him a series of Nissan competitions to become an actual professional racecar driver.,"[12, 28, 18]",295.766,2023-08-09,8.0,1727
Killers of the Flower Moon,Killers of the Flower Moon,466420,en,"When oil is discovered in 1920s Oklahoma under Osage Nation land, the Osage people are murdered one by one—until the FBI steps in to unravel the mystery.","[80, 18, 36]",324.738,2023-10-18,7.5,1749
The Nun II,The Nun II,968051,en,"In 1956 France, a priest is violently murdered, and Sister Irene begins to investigate. She once again comes face-to-face with a powerful evil.","[27, 9648, 53]",303.354,2023-09-06,6.9,1597
Jawan,जवान,872906,hi,"An emotional journey of a prison warden, driven by a personal vendetta while keeping up to a promise made years ago, recruits inmates to commit outrageous crimes that shed light on corruption and injustice, in an attempt to get even with his past,  and that leads him to an unexpected reunion.","[28, 12, 53]",267.988,2023-09-07,7.3,162
Heart of Stone,Heart of Stone,724209,en,An intelligence operative for a shadowy global peacekeeping agency races to stop a hacker from stealing its most valuable — and dangerous — weapon.,"[53, 28]",235.412,2023-08-09,6.9,1400
The Bad Guys: A Very Bad Holiday,The Bad Guys: A Very Bad Holiday,1046032,en,"To keep their annual Holiday Heist-tacular afloat, Mr. Wolf and his crew of animal outlaws will have to restore the whole city's Christmas spirit — fast!","[16, 35, 10751, 28]",245.245,2023-11-30,6.7,75
Ballerina,발레리나,961268,ko,"Grieving the loss of a best friend she couldn't protect, an ex-bodyguard sets out to fulfill her dear friend's last wish: sweet revenge.","[28, 53]",404.062,2023-10-05,7.0,355
Mission: Impossible - Dead Reckoning Part One,Mission: Impossible - Dead Reckoning Part One,575264,en,"Ethan Hunt and his IMF team embark on their most dangerous mission yet: To track down a terrifying new weapon that threatens all of humanity before it falls into the wrong hands. With control of the future and the world's fate at stake and dark forces from Ethan's past closing in, a deadly race around the globe begins. Confronted by a mysterious, all-powerful enemy, Ethan must consider that nothing can matter more than his mission—not even the lives of those he cares about most.","[28, 53]",280.113,2023-07-08,7.6,2827
The Velveteen Rabbit,The Velveteen Rabbit,1186957,en,"When seven-year-old William receives a new favorite toy for Christmas, he discovers a lifelong friend and unlocks a world of magic.","[16, 10751, 14]",254.88,2023-11-21,7.3,40
Sound of Freedom,Sound of Freedom,678512,en,"The story of Tim Ballard, a former US government agent, who quits his job in order to devote his life to rescuing children from global sex traffickers.","[28, 18]",308.279,2023-07-03,8.1,1721
The Marvels,The Marvels,609681,en,"Carol Danvers, aka Captain Marvel, has reclaimed her identity from the tyrannical Kree and taken revenge on the Supreme Intelligence. But unintended consequences see Carol shouldering the burden of a destabilized universe. When her duties send her to an anomalous wormhole linked to a Kree revolutionary, her powers become entangled with that of Jersey City super-fan Kamala Khan, aka Ms. Marvel, and Carol’s estranged niece, now S.A.B.E.R. astronaut Captain Monica Rambeau. Together, this unlikely trio must team up and learn to work in concert to save the universe.","[878, 12, 28]",280.429,2023-11-08,6.4,773
Guardians of the Galaxy Vol. 3,Guardians of the Galaxy Vol. 3,447365,en,"Peter Quill, still reeling from the loss of Gamora, must rally his team around him to defend the universe along with protecting one of their own. A mission that, if not completed successfully, could quite possibly lead to the end of the Guardians as we know them.","[878, 12, 28]",248.943,2023-05-03,8.0,5632
Believer 2,독전 2,958263,ko,A determined detective continues his search for the truth behind Asia's largest drug organization and its elusive boss he has unfinished business with.,"[80, 28, 53]",260.871,2023-10-05,7.1,49
Indiana Jones and the Dial of Destiny,Indiana Jones and the Dial of Destiny,335977,en,"Finding himself in a new era, and approaching retirement, Indy wrestles with fitting into a world that seems to have outgrown him. But as the tentacles of an all-too-familiar evil return in the form of an old rival, Indy must don his hat and pick up his whip once more to make sure an ancient and powerful artifact doesn't fall into the wrong hands.","[12, 28]",252.369,2023-06-28,6.6,2531
Diary of a Wimpy Kid Christmas: Cabin Fever,Diary of a Wimpy Kid Christmas: Cabin Fever,1123093,en,"The winter holidays are turning out to be especially stressful for Greg Heffley this year. After accidentally damaging a snowplow while making a snowman with best friend Rowley Jefferson, Greg worries he won’t get the new video game console he so desperately wants for Christmas. To make matters worse, he gets snowed in with his family, including his grumpy older brother Rodrick and annoying younger brother Manny.","[16, 35, 10751]",223.199,2023-12-08,7.1,35
The Last Voyage of the Demeter,The Last Voyage of the Demeter,635910,en,The crew of the merchant ship Demeter attempts to survive the ocean voyage from Carpathia to London as they are stalked each night by a merciless presence onboard the ship.,"[53, 27]",256.087,2023-08-09,7.1,1065
The Engineer,The Engineer,1156255,en,"As Israel is rocked by a series of terrorist bombings, a US senator's daughter is killed in one bloody explosion. Now, ex-Mossad agent Etan must lead an elite, covert team of agents and mercenaries to find the man responsible—the elusive “Engineer.” Can they find and destroy the madman before more innocent lives are lost?","[28, 53]",204.923,2023-08-18,6.5,50
Adipurush,आदिपुरुष,734253,hi,"7000 years ago, Ayodhya's Prince Raghava and Prince Sesh along with the Mighty Vanar Warriors travels to the island of Lanka with an aim to rescue Raghava's wife Janaki, who has been abducted by Lankesh, the king of Lanka.","[28, 12, 18, 14]",210.545,2023-06-16,5.2,68
Napoleon,Napoleon,753342,en,"An epic that details the checkered rise and fall of French Emperor Napoleon Bonaparte and his relentless journey to power through the prism of his addictive, volatile relationship with his wife, Josephine.","[18, 36, 10752]",243.44,2023-11-22,6.4,870
Warhorse One,Warhorse One,1076487,en,A gunned down Navy SEAL Master Chief must guide a child to safety through a gauntlet of hostile Taliban insurgents and survive the brutal Afghanistan wilderness.,"[28, 18, 10752]",217.006,2023-06-30,7.2,190
Justice League: Warworld,Justice League: Warworld,1003581,en,"Until now, the Justice League has been a loose association of superpowered individuals. But when they are swept away to Warworld, a place of unending brutal gladiatorial combat, Batman, Superman, Wonder Woman and the others must somehow unite to form an unbeatable resistance able to lead an entire planet to freedom.","[16, 28, 878, 12]",215.339,2023-07-25,7.2,193
Society of the Snow,La sociedad de la nieve,906126,es,"On October 13, 1972, Uruguayan Air Force Flight 571, chartered to take a rugby team to Chile, crashes into a glacier in the heart of the Andes.","[18, 36]",334.459,2023-12-14,8.0,115
Carl's Date,Carl's Date,1076364,en,"Carl Fredricksen reluctantly agrees to go on a date with a lady friend—but admittedly has no idea how dating works these days. Ever the helpful friend, Dug steps in to calm Carl's pre-date jitters and offer some tried-and-true tips for making friends—if you're a dog.","[16, 12, 10751]",205.967,2023-06-15,7.5,340
The Conference,Konferensen,1161048,sv,"A team-building conference for municipal employees turns into a nightmare when accusations of corruption begin to circulate and plague the work environment. At the same time, a mysterious figure begins murdering the participants.","[27, 35, 53]",291.546,2023-10-13,5.4,229
