Title,Original title,ID,Language,Details,Genre IDs,Popularity,Release date,Review score,Number of reviews
The Park,The Park,1084225,en,"A dystopian coming-of-age movie focused on three kids who find themselves in an abandoned amusement park, aiming to unite whoever remains. With dangers lurking around every corner, they will do whatever it takes to survive their hellish Neverland.","[28, 18, 27, 878, 53]",33.387,2023-03-02,5.8,54
Burning Betrayal,O Lado Bom de Ser Traída,1173558,pt,"Babi discovers a betrayal by her long-term partner and decides to embark on a new adventure in life. On this journey, she meets judge Marco and they begin to live a story permeated by a lot of sexual tension.","[10749, 9648, 18]",45.899,2023-10-25,5.7,81
Concrete Utopia,콘크리트 유토피아,729854,ko,"The world has been reduced to rubble by a massive earthquake. While no one knows for sure how far the ruins stretch, or what the cause of the earthquake may be, in the heart of Seoul there is only one apartment building left standing. It is called Hwang Gung Apartments. As time passes, outsiders start coming in to Hwang Gung Apartments trying to escape the extreme cold. Before long, the apartment residents are unable to cope with the increasing numbers. Feeling a threat to their very survival, the residents enact a special measure.","[53, 878, 18]",32.817,2023-08-09,7.1,50
Last Sentinel,Last Sentinel,516806,en,"Set in the future on a war-ravaged Earth, four exhausted soldiers man Sentinel - a remote military base in a vast ocean that separates two warring continents. While their tour of duty ended three months ago, the relief crew still hasn't arrived and as the empty weeks turn to months, paranoia descends, testing relationships to breaking point...","[878, 53]",26.993,2023-03-17,5.6,103
Kill Boksoon,길복순,849869,ko,"At work, she's a renowned assassin. At home, she's a single mom to a teenage daughter. Killing? That's easy. It's parenting that's the hard part.","[28, 18, 53]",29.35,2023-02-17,6.9,349
Island of the Dolls,Island of the Dolls,981324,en,A group of people go to the legendary Island of the Dolls to learn the deadly truth.,[27],37.447,2023-01-13,5.5,36
Run Rabbit Run,Run Rabbit Run,714669,en,"Sarah is a fertility doctor with a firm understanding of the cycle of life. When she is forced to make sense of the increasingly strange behavior of her young daughter Mia, she must challenge her own beliefs and confront a ghost from her past.","[27, 53]",36.114,2023-01-19,5.3,192
Tin & Tina,Tin & Tina,943930,es,"After a traumatic miscarriage, Lola and her husband Adolfo adopt Tin and Tina, a lovely albino brother and sister with an ultra-catholic education that makes them interpret Holy Bible verbatim.","[27, 53, 9648]",36.823,2023-03-24,6.0,339
The Communion Girl,La niña de la comunión,1008005,es,"May, 1987. While returning from a nightclub and after having taken drugs, new girl in town Sara and her friend Rebe find a doll wearing a communion dress. From that moment, their lives will become a living hell.",[27],36.344,2023-02-09,6.2,189
The Shepherd,The Shepherd,1116488,en,"On Christmas Eve, a fighter pilot on his way home gets lost mid-flight over water and needs a miracle to land safely.","[18, 14, 28]",30.43,2023-08-10,6.8,69
The Mistress,The Mistress,1094713,en,"Newlyweds Parker and Madeline move into their dream home. As they settle in, they discover a box of old love letters written to the original owner. And as the couple digs into the increasingly obsessive correspondence, a mysterious woman arrives with a horrifying secret that threatens their lives.","[27, 53]",24.458,2023-07-28,4.8,11
The Devil on Trial,The Devil on Trial,1171989,en,"Explore the first – and only – time “demonic possession” has officially been used as a defense in a U.S. murder trial. Including firsthand accounts of alleged devil possession and a shocking murder, this extraordinary story forces reflection on our fear of the unknown.",[99],28.929,2023-10-17,6.1,56
Mr. Monk's Last Case: A Monk Movie,Mr. Monk's Last Case: A Monk Movie,1100795,en,Monk steps out of retirement as his stepdaughter's wedding turns tragic when her fiancé dies in a bungee jumping accident.,"[9648, 35, 80]",36.558,2023-12-08,7.2,55
Your Christmas or Mine 2,Your Christmas or Mine 2,1176139,en,They've swapped Christmas – again. Can Hayley and James' relationship survive another turbulent family Christmas or has their future together gone off-piste?!,"[10749, 35]",27.146,2023-12-07,6.5,72
Close Your Eyes,Cerrar los ojos,997294,es,"Years after his mysterious disappearance, Julio Arenas, a famous Spanish actor, is back in the news thanks to a television program.","[18, 9648]",32.995,2023-08-16,6.7,24
Detective Knight: Independence,Detective Knight: Independence,1035806,en,"Detective James Knight 's last-minute assignment to the Independence Day shift turns into a race to stop an unbalanced ambulance EMT from imperiling the city's festivities. The misguided vigilante, playing cop with a stolen gun and uniform, has a bank vault full of reasons to put on his own fireworks show... one that will strike dangerously close to Knight's home.","[28, 80, 53]",31.172,2023-01-20,5.4,154
Forgotten Love,Znachor,1081676,pl,A once-respected surgeon who's lost his family and his memory gets a chance at redemption when he reconnects with someone from his forgotten past.,"[18, 10749]",28.665,2023-09-27,8.2,183
"Relax, I'm from the Future","Relax, I'm from the Future",994133,en,"Casper is a time traveller who arrives in the 2020s in an attempt to prevent a major future catastrophe. He meets Holly, a queer black woman he befriends and draws into his plan by giving her his knowledge of the future so that she can make quick money. However, they unwittingly alter the future themselves with their actions, until Doris, another time traveller, arrives to stop them.","[35, 878]",27.958,2023-09-22,6.0,12
The Retirement Plan,The Retirement Plan,866346,en,"When Ashley and her young daughter Sarah get caught up in a criminal enterprise that puts their lives at risk, she turns to the only person who can help: her estranged father Matt, currently living the life of a retired beach bum in the Cayman Islands. Their reunion is fleeting as they are soon tracked down on the island by crime boss Donnie and his lieutenant Bobo. As Ashley, Sarah, and Matt become entangled in an increasingly dangerous web, Ashley quickly learns her father had a secret past that she knew nothing about and that there is more to her father than meets the eye.","[35, 28]",33.736,2023-08-24,6.5,115
The Dive,The Dive,1109534,da,"Two sisters go diving at a beautiful, remote location. One of the sisters is struck by a rock, leaving her trapped 28 meters below. With dangerously low levels of oxygen and cold temperatures, it is up to her sister to fight for her life.",[53],34.186,2023-08-24,6.6,112
Snag,Snag,1105803,en,"An Australian lone wolf's quiet existence is shattered when he learns that the woman he once loved and thought was dead is alive and held captive by ruthless gangsters. Now, to take on this dangerous criminal organization, he must seek out allies and storm into a world of violence to rescue the love of his life in this gritty, modern day violent fairytale.","[28, 80, 53]",34.083,2023-04-28,5.9,41
The Sexologist,La Sexóloga,1179496,es,"A sexologist (Flavia Dos Santos) dedicates herself to meticulously investigating every detail of the sexual lives of 3 couples and tries to save their marriages without affecting their love lives. This fun and unorthodox methodology will take each of its patients on a journey where the smell, accents, role-playing and other events will force them to leave their comfort zone with the sole purpose of saving their relationships. .",[35],29.056,2023-01-05,6.8,27
Asterix & Obelix: The Middle Kingdom,Astérix & Obélix : L'Empire du Milieu,643215,fr,Gallic heroes and forever friends Asterix and Obelix journey to China to help Princess Sa See save the Empress and her land from a nefarious prince.,"[10751, 35, 12]",34.294,2023-02-01,4.9,800
Big George Foreman,Big George Foreman,878361,en,"Fueled by an impoverished childhood, George Foreman channeled his anger into becoming an Olympic Gold medalist and World Heavyweight Champion, followed by a near-death experience that took him from the boxing ring to the pulpit. But when he sees his community struggling spiritually and financially, Foreman returns to the ring and makes history by reclaiming his title, becoming the oldest and most improbable World Heavyweight Boxing Champion ever.","[18, 36, 99]",33.759,2023-04-27,7.7,173
Elf Me,Elf Me,938030,it,A bumbling Christmas elf whose Santa's helper job is jeopardized by a complete inability in building toys teams up with a kid harassed by bullies.,"[10751, 35, 14, 12]",27.983,2023-11-24,5.8,67
Curry & Cyanide: The Jolly Joseph Case,Curry & Cyanide: The Jolly Joseph Case,1217392,ml,This true-crime documentary investigates six shocking deaths in the same family and the woman at the center of the unbelievable case: Jolly Joseph.,"[99, 80]",40.0,2023-12-22,6.7,13
Christmas As Usual,Så var det jul igjen,1202584,no,"To celebrate their engagement, Thea takes Jashan home — but his Indian roots and her family's Norwegian traditions clash in a chaotic Christmas.","[10749, 35, 18]",20.865,2023-12-06,5.6,60
The Sacrifice Game,The Sacrifice Game,973471,en,"Christmas break, 1971. Samantha and Clara, two students who are staying behind for the holidays at their boarding school, must survive the night after the arrival of uninvited visitors.","[27, 53]",30.075,2023-12-07,6.0,18
Unwelcome,Unwelcome,758769,en,"Londoners Maya and Jamie escape their urban nightmare to the tranquility of rural Ireland only to discover malevolent, murderous goblins lurking in the gnarled, ancient wood at the foot of their new garden. When heavily pregnant Maya’s relationship with a local family turns sour, who – or what – will come to her rescue and to what extremes will she go to protect her unborn child?",[27],29.178,2023-01-27,5.9,114
Gunfight at Rio Bravo,Gunfight at Rio Bravo,835767,en,"When mysterious Russian gunslinger Ivan Turchin rides into a small Texas town, he runs afoul of a bloodthirsty outlaw gang known as The Hellhounds. Outmanned and outgunned, the town must put their trust in Turchin to protect them from annihilation at the hands of the bandits. The gunslinger finds allies in the form of Marshal Austin Carter and Sheriff Vernon Kelly, and together the three must make a desperate stand against impossible and violent odds.","[37, 28]",45.451,2023-01-13,6.1,28
Perfect Addiction,Perfect Addiction,845659,en,A female boxing trainer discovers that her champion cage-fighter boyfriend has been cheating on her with her sister and decides to seek revenge by training up his arch-rival to challenge him.,"[18, 10749]",28.159,2023-02-16,6.7,204
Assassin Club,Assassin Club,876969,en,"In this world of contract killers, Morgan Gaines is the best of the best. When Morgan is hired to kill six people around the world, he soon discovers all the targets are also assassins unknowingly hired to kill each other.","[28, 9648, 53, 80]",31.599,2023-02-24,6.2,127
Dunki,ਡੰਕੀ,960876,hi,"Four friends from a sleepy little village in Punjab share a common dream: to go to England. Their problem is that they have neither the visa nor the ticket. A soldier alights from a train one day, and their lives change. He gives them a soldier's promise: He will take them to the land of their dreams. What follows is a hilarious and heartwarming tale of a perilous journey through the desert and the sea, but most crucially through the hinterlands of their mind.","[35, 18]",22.225,2023-12-21,6.4,22
Pain Hustlers,Pain Hustlers,862968,en,"After losing her job, a single mom falls into a lucrative but ultimately dangerous scheme selling prescription drugs.","[18, 80]",38.824,2023-10-20,6.7,361
The King of Algiers,Omar la fraise,995767,fr,"Omar, better known as Omar the Strawberry, is an old-fashioned bandit. Forced to flee to Algeria, he makes a living out of petty crime, accompanied by his famous sidekick Roger. After decades of ruling the French criminal underworld, they must come to terms with their new life together, which until now has been one of debauchery and violence.","[35, 18]",33.994,2023-05-24,6.1,70
Baby Assassins 2 Babies,ベイビーわるきゅーれ2ベイビー,1077600,ja,"Chisato and Mahiro were banned from performing tasks because they violated the organization's rules?! Needing money to make ends meet, they resumed their days as part time workers. The two are busy working to earn money, but they suddenly encounter other assassins who are after them. What should they do if they can't reveal their identity as assassins when they are not on duty?","[28, 18, 80, 35]",28.644,2023-03-24,6.9,11
Barbie: Skipper and the Big Babysitting Adventure,Barbie: Skipper and the Big Babysitting Adventure,1093349,en,"Barbie’s younger sister Skipper is a babysitting expert, but when her babysitting business hits a snag, she takes a summer job at a water park and tries out different jobs with some new friends. A birthday party at the park goes awry and Skipper’s babysitting skills save the day! The success renews Skipper’s confidence in her babysitting business, and she and her new friends start a babysitting squad.","[16, 10751]",27.005,2023-03-03,7.1,39
Jeanne du Barry,Jeanne du Barry,921452,fr,"The life of Jeanne Bécu, who was born as the illegitimate daughter of an impoverished seamstress in 1743 and went on to rise through the Court of Louis XV to become his last official mistress.","[18, 36, 10749]",32.19,2023-05-16,7.0,293
Locked In,Locked In,1064024,en,"A kindly nurse tries to unlock the secrets of a coma patient's injuries — and discovers the bitter rivalry, infidelity, betrayal and murder behind them.",[53],35.74,2023-11-01,5.5,140
Home for Rent,บ้านเช่า..บูชายัญ,977177,th,"A film inspired by terrifying true events. When the tenants are members of a dark cult, they terrorize the homeowner, looking for their next prey to sacrifice.","[27, 53, 9648]",28.216,2023-04-06,7.0,82
One Day as a Lion,One Day as a Lion,1070777,en,"Jackie Powers will stop at nothing to prevent his son from following him into a life of crime. With his mob employer in pursuit, a chance encounter at a roadside diner charts a new path.","[28, 53, 80]",26.484,2023-04-04,5.7,110
Disquiet,Disquiet,1072074,en,"After a near-fatal car accident, Sam wakes to discover he is trapped in an abandoned hospital by mysterious and sinister forces that have no intention of letting him leave…","[27, 53, 9648]",18.548,2023-02-10,6.1,67
Salaar: Part 1 – Ceasefire,Salaar: Part 1 – Ceasefire,770906,te,"In the city of Khansaar, Raja Mannar plans to make his son, Vardharaja Mannar his successor, but Raja Mannar's ministers and advisors plan a coup d'état by hiring armies from Russia and Serbia to attack and kill Vardha and Raja. Vardha, along with his brother and a few trusted men, manage to escape from Khansaar. Vardha goes to his childhood best friend, Deva, who learns about his predicament and sets out to make him the undisputed successor of Khansaar.","[28, 80, 53]",26.146,2023-12-21,6.9,19
Mujib: The Making of a Nation,মুজিব: একটি জাতির রূপকার,680133,bn,"Biopic on the father of the nation of Bangladesh, Sheikh Mujibur Rahman. The film will showcase his growing up as a child to his standing up against all injustice in his youth to fighting for the independence of his country. How he led a country to it's independence with his inspirational presence and fight for the justice.","[18, 36, 10752]",30.006,2023-10-27,8.3,13
Supercell,Supercell,842945,en,"Good-hearted teenager William always lived in hope of following in his late father’s footsteps and becoming a storm chaser. His father’s legacy has now been turned into a storm-chasing tourist business, managed by the greedy and reckless Zane Rogers, who is now using William as the main attraction to lead a group of unsuspecting adventurers deep into the eye of the most dangerous supercell ever seen.",[28],25.629,2023-03-17,5.9,230
Influencer,Influencer,1020910,en,"While struggling on a solo backpacking trip in Thailand, social media influencer Madison meets CW, who travels with ease and shows her a more uninhibited way of living. But CW's interest in her takes a darker turn.","[53, 9648, 27]",41.769,2023-05-18,6.2,106
Wonderwell,Wonderwell,456483,en,"In an idyllic Italian village, a young American girl on the threshold of adolescence is swept into a timeless magical adventure in Wonderwell.","[14, 10751, 18]",19.521,2023-06-23,6.3,13
Genie,Genie,1189198,en,"Flora, a genie trapped for more than 2,000 years inside an antique jewelry box, is accidentally called to service by Bernard, whose life is unraveling around him.","[14, 35]",25.725,2023-11-22,7.1,92
Breakout,Breakout,926680,en,"Having taken control of a maximum security prison, a criminal mastermind faces off against a retired Black Ops agent who had been visiting his incarcerated son.","[28, 53]",32.091,2023-04-11,4.2,18
¡Salta!,¡Salta!,1109146,gl,"Oscar and Teo (13 and 11 years old) are two brothers, very different from each other, who will have to face the loss of their mother, a scientist obsessed with wormholes.","[35, 10751, 878, 18]",27.001,2023-09-01,6.1,14
Tiger 3,Tiger 3,720557,hi,"Following the events of Tiger Zinda Hai, War, and Pathaan, Avinash Singh Rathore returns as Tiger but this time the battle is within. He has to choose between his country or family as an old enemy is after his life, who claims that his family was killed by Tiger. He holds Tiger captive in Pakistan as the Indian agent's loyalty towards his country faces its biggest test.","[28, 12, 53]",19.09,2023-11-12,6.3,10
The Wonderful Story of Henry Sugar,The Wonderful Story of Henry Sugar,923939,en,A rich man learns about a guru who can see without using his eyes. He sets out to master the skill in order to cheat at gambling.,"[35, 12, 14]",27.645,2023-09-20,7.3,588
Gangs of Lagos,Gangs of Lagos,1104040,en,"A group of friends who each have to navigate their own destiny, growing up on the bustling streets and neighborhood of Isale Eko, Lagos.",[80],20.719,2023-04-07,6.3,43
Huesera: The Bone Woman,Huesera,772515,es,"Valeria's joy at becoming a first-time mother is quickly taken away when she's cursed by a sinister entity. As danger closes in, she's forced deeper into a chilling world of dark magic that threatens to consume her.","[18, 27, 9648]",23.372,2023-02-10,5.8,274
Butcher's Crossing,Butcher's Crossing,843846,en,"In the 1870s, a young Harvard dropout seeks his destiny out West by tying his fate to a team of buffalo hunters led by a man named Miller. Together, they embark on a harrowing journey risking life and sanity.","[37, 18]",32.21,2023-02-03,5.8,38
The Archies,The Archies,975533,hi,"Set in 1960s India, Archie and the gang navigate romance, friendship and the future of Riverdale as developers threaten to destroy a beloved park.","[35, 18, 10402, 10749]",22.865,2023-12-07,6.5,39
Leo,லியோ,949229,ta,"A mild-mannered man becomes a local hero through an act of violence, but it brings forth consequences with connection to a dangerous world, one which will shake his carefully constructed life to its very core.","[28, 12, 80, 53]",22.438,2023-10-18,7.2,49
Taz: Quest for Burger,Taz: Quest for Burger,1109207,en,"After an outlaw abducts her father and steals her town’s food supply, a feisty adolescent bandicoot named Quinn recruits the Tasmanian Devil to help her find the thief. Taz may be an ill-tempered rogue with a fearsome reputation, but he and Quinn will have to work together to track the criminal through the wilds of Tasmania and save her community.","[35, 10751, 16, 12]",28.087,2023-06-06,5.8,26
My Big Fat Greek Wedding 3,My Big Fat Greek Wedding 3,1001811,en,"Following the death of their patriarch Gus, the Portokalos family travels to Greece for a family reunion, and to deliver Gus' journal to his old friends.","[35, 10749]",23.959,2023-09-07,6.4,87
Friends & Family Christmas,Friends & Family Christmas,1180706,en,"Daniella and Amelia, set up by their parents, pretend that they are dating to make their families happy for the holidays.","[10770, 10751, 10749]",38.751,2023-12-17,7.0,10
Summer Vacation,Vacaciones de verano,1061634,es,"When two friends lose their jobs and find gigs as children's entertainers at a luxury hotel, they sneak in their kids to give them a summer vacation.","[35, 10751]",23.148,2023-07-06,5.5,30
Quiz Lady,Quiz Lady,787781,en,"A brilliant but tightly wound, gameshow-obsessed young woman, Anne, and her estranged, train-wreck of a sister Jenny, must work together to help cover their mother’s gambling debts. When Anne’s beloved dog is kidnapped, they set out on a wild, cross-country trek to get the cash the only way they know how: by turning Anne into a bona-fide gameshow champion.",[35],24.139,2023-09-09,6.8,140
Bunker,Bunker,1032666,en,"Trapped in a bunker during World War I, a group of soldiers are faced with an ungodly presence that slowly turns them against each other.","[27, 53, 10752]",18.381,2023-09-14,7.1,20
Between Us,Entre nous,828373,fr,"Elodie and Laetitia live in close love and dream of having a child. As Elodie discovers that she cannot get pregnant because of a health problem and encounters financial troubles, they decide to take a roommate.",[18],24.557,2023-07-12,6.2,70
All Souls,All Souls,940143,en,"A young confidential informant is sent on a dangerous undercover operation. It's a no-holds-barred look at the vulnerable foot soldiers of the War on Drugs, young criminals who are pressured to work for the police.","[80, 18, 53]",25.624,2023-12-08,7.2,20
The Old Way,The Old Way,872954,en,"An old gunslinger and his daughter must face the consequences of his past, when the son of a man he killed years ago arrives to take his revenge.",[37],19.632,2023-01-06,5.9,144
The Eternal Memory,La memoria infinita,1032760,es,"Augusto and Paulina have been together for 25 years. Eight years ago, he was diagnosed with Alzheimer's disease. Both fear the day he no longer recognizes her.",[99],26.65,2023-08-11,9.0,17
Nightmare Radio: The Night Stalker,Nightmare Radio: The Night Stalker,1035798,en,"A late-night radio DJ with a program where people call to tell her real horror stories, soon will find out how far an obsessed fan is willing to go.",[27],26.064,2023-04-18,5.3,23
Dating Santa,"Santa, mi amor",1192330,es,"Lucia is a consummate professional and the single mother of Leo, her beautiful and mischievous 6-year-old daughter, who is obsessed with Christmas and believes her birth was due to a Christmas miracle. Between her two full-time jobs (motherhood and architecture), she has neither the time nor the inclination to fall in love again, but when she reluctantly agrees to go on a blind date with Sergio, a handsome and likeable chef, the spark is undeniable.","[18, 35, 10749]",20.614,2023-12-07,7.9,22
Unseen,Unseen,1067714,en,"Sam receives a call from Emily, a near blind woman who is running from her murderous ex in the woods. Can she survive using Sam as her eyes via video call?","[53, 27, 9648]",21.501,2023-03-07,6.2,39
Missing,Missing,768362,en,"When her mother disappears while on vacation in Colombia with her new boyfriend, June’s search for answers is hindered by international red tape. Stuck thousands of miles away in Los Angeles, June creatively uses all the latest technology at her fingertips to try and find her before it’s too late. But as she digs deeper, her digital sleuthing raises more questions than answers... and when June unravels secrets about her mom, she discovers that she never really knew her at all.","[53, 9648]",24.617,2023-01-19,7.5,802
Champions,Champions,933419,en,A stubborn and hotheaded minor league basketball coach is forced to train a Special Olympics team when he is sentenced to community service.,[35],24.214,2023-03-09,6.9,240
Legion of Super-Heroes,Legion of Super-Heroes,1003580,en,"Kara, devastated by the loss of Krypton, struggles to adjust to her new life on Earth. Her cousin, Superman, mentors her and suggests she leave their space-time to attend the Legion Academy in the 31st century, where she makes new friends and a new enemy: Brainiac 5. Meanwhile, she must contend with a mysterious group called the Dark Circle as it searches for a powerful weapon held in the Academy’s vault.","[16, 28, 878]",27.774,2023-02-07,6.6,153
Inside,Inside,958196,en,"An art thief becomes trapped in a New York penthouse after his heist goes awry. Imprisoned with nothing but priceless works of art, he must use all his cunning and invention to survive.","[18, 53]",31.273,2023-03-09,5.7,248
Mayhem!,Farang,959092,fr,"Sam is a professional boxer about to get released from prison. While on parole, his past catches up with him and he has no choice but to flee. Five years later, he has rebuilt a simple life on an exotic island in Thailand with his wife and her daughter, but when he gets blackmailed by a dangerous local godfather, he must embark on a dangerous drug smuggling mission which results in a tragedy. Now has only one purpose: to seek merciless vengeance.","[28, 80, 18]",24.778,2023-06-28,6.8,49
